 {
    "hotels": ["6752", "6722", "0716", "5282"],
    "conditions": {
        "context": "MULTI_HOTELS",
        "packagedMainProductToFilter": ["ESCALV", "ESCALB"]
    },
    "unqualifiedPolicy": "QUALIFIED_AND_UNQUALIFIED",
    "segmentCriterias": [{
        "dateIn": "2017-01-25",
        "los": 2,
        "nbRooms": 1,
        "paxCriteria": {
            "pax": 2,
            "nbChildrens": 0,
            "childrenAges": []
        }
    }],
    "mainCroSubCroPK": {
        "mainCro": "INT",
        "subCro": "WTC"
    }
}